{
  "schema_version": 4,
  "id": "core:burn_the_plague_barrow",
  "display_name_key": "contract.core.burn_the_plague_barrow.name",
  "patron_fee": 45,
  "risk": 40,
  "required_crew": 3,
  "needs": { "frontline": 20, "undead_knowledge": 40 },
  "tags": ["target:undead", "target:temple"],
  "negotiable_tags": ["method:open", "method:public_contract"]
}
